[
  {
    "schema_version": "2.0",
    "run_id": "m5_positive_seed_1_b",
    "step_index": 0,
    "simulation_time_s": 0.0,
    "simulation_step_s": 0.5,
    "seed": 1,
    "agents": [
      {
        "agent_id": "Porpoise_001",
        "species": "harbour_porpoise",
        "behavioural_state": "surface",
        "horizontal_position_m": [
          -7.9091221654151145,
          1.202408654551074
        ],
        "heading_deg": 8.64437508769663,
        "speed_mps": 0.5,
        "vertical_reference": "mean_sea_level",
        "depth_m": 0.2
      }
    ]
  },
  {
    "schema_version": "2.0",
    "run_id": "m5_positive_seed_1_b",
    "step_index": 1,
    "simulation_time_s": 0.5,
    "simulation_step_s": 0.5,
    "seed": 1,
    "agents": [
      {
        "agent_id": "Porpoise_001",
        "species": "harbour_porpoise",
        "behavioural_state": "surface",
        "horizontal_position_m": [
          -7.867691448641171,
          1.448941430485922
        ],
        "heading_deg": 10.434868197480455,
        "speed_mps": 0.5,
        "vertical_reference": "mean_sea_level",
        "depth_m": 0.2
      }
    ]
  },
  {
    "schema_version": "2.0",
    "run_id": "m5_positive_seed_1_b",
    "step_index": 2,
    "simulation_time_s": 1.0,
    "simulation_step_s": 0.5,
    "seed": 1,
    "agents": [
      {
        "agent_id": "Porpoise_001",
        "species": "harbour_porpoise",
        "behavioural_state": "surface",
        "horizontal_position_m": [
          -7.818578064684499,
          1.6940593397028318
        ],
        "heading_deg": 12.22536130726428,
        "speed_mps": 0.5,
        "vertical_reference": "mean_sea_level",
        "depth_m": 0.2
      }
    ]
  },
  {
    "schema_version": "2.0",
    "run_id": "m5_positive_seed_1_b",
    "step_index": 3,
    "simulation_time_s": 1.5,
    "simulation_step_s": 0.5,
    "seed": 1,
    "agents": [
      {
        "agent_id": "Porpoise_001",
        "species": "harbour_porpoise",
        "behavioural_state": "surface",
        "horizontal_position_m": [
          -7.761829971931064,
          1.9375230287231708
        ],
        "heading_deg": 14.015854417048104,
        "speed_mps": 0.5,
        "vertical_reference": "mean_sea_level",
        "depth_m": 0.2
      }
    ]
  },
  {
    "schema_version": "2.0",
    "run_id": "m5_positive_seed_1_b",
    "step_index": 4,
    "simulation_time_s": 2.0,
    "simulation_step_s": 0.5,
    "seed": 1,
    "agents": [
      {
        "agent_id": "Porpoise_001",
        "species": "harbour_porpoise",
        "behavioural_state": "shallow_swim",
        "horizontal_position_m": [
          -7.697502583930411,
          2.1790947593862557
        ],
        "heading_deg": 15.806347526831928,
        "speed_mps": 0.5,
        "vertical_reference": "mean_sea_level",
        "depth_m": 0.2
      }
    ]
  },
  {
    "schema_version": "2.0",
    "run_id": "m5_positive_seed_1_b",
    "step_index": 5,
    "simulation_time_s": 2.5,
    "simulation_step_s": 0.5,
    "seed": 1,
    "agents": [
      {
        "agent_id": "Porpoise_001",
        "species": "harbour_porpoise",
        "behavioural_state": "shallow_swim",
        "horizontal_position_m": [
          -7.625658715285268,
          2.4185386409966325
        ],
        "heading_deg": 17.596840636615752,
        "speed_mps": 0.5,
        "vertical_reference": "mean_sea_level",
        "depth_m": 0.22578125000000002
      }
    ]
  },
  {
    "schema_version": "2.0",
    "run_id": "m5_positive_seed_1_b",
    "step_index": 6,
    "simulation_time_s": 3.0,
    "simulation_step_s": 0.5,
    "seed": 1,
    "agents": [
      {
        "agent_id": "Porpoise_001",
        "species": "harbour_porpoise",
        "behavioural_state": "shallow_swim",
        "horizontal_position_m": [
          -7.546368520314156,
          2.6556208606673364
        ],
        "heading_deg": 19.387333746399577,
        "speed_mps": 0.5,
        "vertical_reference": "mean_sea_level",
        "depth_m": 0.29375
      }
    ]
  },
  {
    "schema_version": "2.0",
    "run_id": "m5_positive_seed_1_b",
    "step_index": 7,
    "simulation_time_s": 3.5,
    "simulation_step_s": 0.5,
    "seed": 1,
    "agents": [
      {
        "agent_id": "Porpoise_001",
        "species": "harbour_porpoise",
        "behavioural_state": "shallow_swim",
        "horizontal_position_m": [
          -7.459709424546891,
          2.8901099116342093
        ],
        "heading_deg": 21.1778268561834,
        "speed_mps": 0.5,
        "vertical_reference": "mean_sea_level",
        "depth_m": 0.38984375000000004
      }
    ]
  },
  {
    "schema_version": "2.0",
    "run_id": "m5_positive_seed_1_b",
    "step_index": 8,
    "simulation_time_s": 4.0,
    "simulation_step_s": 0.5,
    "seed": 1,
    "agents": [
      {
        "agent_id": "Porpoise_001",
        "species": "harbour_porpoise",
        "behavioural_state": "shallow_swim",
        "horizontal_position_m": [
          -7.365766049119858,
          3.1217768193183244
        ],
        "heading_deg": 22.968319965967225,
        "speed_mps": 0.5,
        "vertical_reference": "mean_sea_level",
        "depth_m": 0.5
      }
    ]
  },
  {
    "schema_version": "2.0",
    "run_id": "m5_positive_seed_1_b",
    "step_index": 9,
    "simulation_time_s": 4.5,
    "simulation_step_s": 0.5,
    "seed": 1,
    "agents": [
      {
        "agent_id": "Porpoise_001",
        "species": "harbour_porpoise",
        "behavioural_state": "shallow_swim",
        "horizontal_position_m": [
          -7.264630128144919,
          3.350395364915779
        ],
        "heading_deg": 24.75881307575105,
        "speed_mps": 0.5,
        "vertical_reference": "mean_sea_level",
        "depth_m": 0.6101562500000001
      }
    ]
  },
  {
    "schema_version": "2.0",
    "run_id": "m5_positive_seed_1_b",
    "step_index": 10,
    "simulation_time_s": 5.0,
    "simulation_step_s": 0.5,
    "seed": 1,
    "agents": [
      {
        "agent_id": "Porpoise_001",
        "species": "harbour_porpoise",
        "behavioural_state": "shallow_swim",
        "horizontal_position_m": [
          -7.156400419132601,
          3.575742306296517
        ],
        "heading_deg": 26.549306185534874,
        "speed_mps": 0.5,
        "vertical_reference": "mean_sea_level",
        "depth_m": 0.70625
      }
    ]
  },
  {
    "schema_version": "2.0",
    "run_id": "m5_positive_seed_1_b",
    "step_index": 11,
    "simulation_time_s": 5.5,
    "simulation_step_s": 0.5,
    "seed": 1,
    "agents": [
      {
        "agent_id": "Porpoise_001",
        "species": "harbour_porpoise",
        "behavioural_state": "shallow_swim",
        "horizontal_position_m": [
          -7.041182606557067,
          3.7975975959964785
        ],
        "heading_deg": 28.3397992953187,
        "speed_mps": 0.5,
        "vertical_reference": "mean_sea_level",
        "depth_m": 0.7742187500000002
      }
    ]
  },
  {
    "schema_version": "2.0",
    "run_id": "m5_positive_seed_1_b",
    "step_index": 12,
    "simulation_time_s": 6.0,
    "simulation_step_s": 0.5,
    "seed": 1,
    "agents": [
      {
        "agent_id": "Porpoise_001",
        "species": "harbour_porpoise",
        "behavioural_state": "descent",
        "horizontal_position_m": [
          -6.919089198657018,
          4.015744596090216
        ],
        "heading_deg": 30.130292405102523,
        "speed_mps": 0.5,
        "vertical_reference": "mean_sea_level",
        "depth_m": 0.8
      }
    ]
  },
  {
    "schema_version": "2.0",
    "run_id": "m5_positive_seed_1_b",
    "step_index": 13,
    "simulation_time_s": 6.5,
    "simulation_step_s": 0.5,
    "seed": 1,
    "agents": [
      {
        "agent_id": "Porpoise_001",
        "species": "harbour_porpoise",
        "behavioural_state": "descent",
        "horizontal_position_m": [
          -6.790239417573313,
          4.229970289734153
        ],
        "heading_deg": 31.920785514886347,
        "speed_mps": 0.5,
        "vertical_reference": "mean_sea_level",
        "depth_m": 0.89453125
      }
    ]
  },
  {
    "schema_version": "2.0",
    "run_id": "m5_positive_seed_1_b",
    "step_index": 14,
    "simulation_time_s": 7.0,
    "simulation_step_s": 0.5,
    "seed": 1,
    "agents": [
      {
        "agent_id": "Porpoise_001",
        "species": "harbour_porpoise",
        "behavioural_state": "descent",
        "horizontal_position_m": [
          -6.654759082930561,
          4.440065489173914
        ],
        "heading_deg": 33.71127862467017,
        "speed_mps": 0.5,
        "vertical_reference": "mean_sea_level",
        "depth_m": 1.14375
      }
    ]
  },
  {
    "schema_version": "2.0",
    "run_id": "m5_positive_seed_1_b",
    "step_index": 15,
    "simulation_time_s": 7.5,
    "simulation_step_s": 0.5,
    "seed": 1,
    "agents": [
      {
        "agent_id": "Porpoise_001",
        "species": "harbour_porpoise",
        "behavioural_state": "descent",
        "horizontal_position_m": [
          -6.512780488976405,
          4.645825040012618
        ],
        "heading_deg": 35.501771734453996,
        "speed_mps": 0.5,
        "vertical_reference": "mean_sea_level",
        "depth_m": 1.49609375
      }
    ]
  },
  {
    "schema_version": "2.0",
    "run_id": "m5_positive_seed_1_b",
    "step_index": 16,
    "simulation_time_s": 8.0,
    "simulation_step_s": 0.5,
    "seed": 1,
    "agents": [
      {
        "agent_id": "Porpoise_001",
        "species": "harbour_porpoise",
        "behavioural_state": "descent",
        "horizontal_position_m": [
          -6.364442275398421,
          4.847048021540675
        ],
        "heading_deg": 37.29226484423782,
        "speed_mps": 0.5,
        "vertical_reference": "mean_sea_level",
        "depth_m": 1.9000000000000001
      }
    ]
  },
  {
    "schema_version": "2.0",
    "run_id": "m5_positive_seed_1_b",
    "step_index": 17,
    "simulation_time_s": 8.5,
    "simulation_step_s": 0.5,
    "seed": 1,